{
  "name": "14_amendment",
  "description": "Favourable amendments: S1 indexes θ 80,000 → 82,400 and lowers the cap 2.5 → 2.4 (attestor-signed, nonce 1); a proof built against the old terms commitment is InvalidProof, the next report pays 4% of income above the new θ. S2 has already paid 250 USDC per unit when its cap is lowered to 2.0 × 105 = 210: the effective cap is max(cap, paid) (no underflow) and a keeper's retire_if_capped retires the series. Reverts: NotIssuer, InvalidAttestorSignature, UnfavourableAmendment (cap up / below bounds), AmendmentAfterTerminal.",
  "schema": 2,
  "specVersion": "1.1",
  "generatedBy": "packages/reference/src/vectors/generate.ts (pnpm vectors)",
  "config": {
    "parameters": {
      "cap_multiple_wad": "2500000000000000000",
      "hurdle_rate_wad": "80000000000000000",
      "payout_multiple_k": "5",
      "lockup_seconds": "47336400",
      "wallet_cap_bps": "1000",
      "auction_fee_bps": "100",
      "payout_fee_bps": "500",
      "window_fee_bps": "100",
      "non_reveal_charge_bps": "100",
      "commit_duration": "604800",
      "reveal_duration": "172800",
      "window_commit_duration": "259200",
      "window_reveal_duration": "86400",
      "report_due_days": "30",
      "grace_days": "15",
      "formal_notice_days": "90",
      "trueup_days": "60",
      "tail_seconds": "31536000",
      "fx_min_coverage_bps": "8000",
      "fx_max_staleness_seconds": "3600",
      "fx_max_conf_bps": "100",
      "fx_deviation_band_bps": "200",
      "max_pause_seconds": "31536000",
      "max_cumulative_pause_seconds": "63072000",
      "max_pauses": "16",
      "max_release_tranches": "24"
    },
    "flags": {
      "newRaisesPaused": false,
      "windowsEnabled": false,
      "tier4Enabled": false
    },
    "stablecoinDecimals": 6,
    "chainDomainNote": "Bid/ask commitments, signed messages and the deployment domain depend on chain-specific wallet bytes and chain id; harnesses recompute them from the plaintext fields here (salts, prices, quantities, periods, nonces, prior/income commitments, liquidity flags) and sign with the keys derived from `keys[*].seed`. Amounts, periods and ledger values are chain-independent."
  },
  "actors": [
    "attestor1",
    "attestor2",
    "b1",
    "b2",
    "b3",
    "b4",
    "issuer",
    "keeper",
    "verifier1"
  ],
  "keys": {
    "attestor1": {
      "seed": "14_amendment:attestor1",
      "derivation": "keccak256(\"MERCES_TEST_KEY\" ‖ utf8(seed)) mod (secp256k1_n − 1) + 1",
      "privateKey": "0xe2a71f4fba088cd69ba3100290e3d25b012e2f121ffdca9dbab5273e84ae856a",
      "address": "0xed2414230e871091df0ea2462507ef4bee0d993a",
      "role": "attestor"
    },
    "attestor2": {
      "seed": "14_amendment:attestor2",
      "derivation": "keccak256(\"MERCES_TEST_KEY\" ‖ utf8(seed)) mod (secp256k1_n − 1) + 1",
      "privateKey": "0x0a122dd5c778c4357945076c175dcc6667dc7a0eed5db824b50abe362002cba5",
      "address": "0x8c8df57a33f88c37e43d273f73d6a6a3b873f23c",
      "role": "attestor"
    },
    "verifier1": {
      "seed": "14_amendment:verifier1",
      "derivation": "keccak256(\"MERCES_TEST_KEY\" ‖ utf8(seed)) mod (secp256k1_n − 1) + 1",
      "privateKey": "0x34767ab6e8d4941c60a8d30a0a9bad7cfb751900a4fcc2fbcc4a0979d907f3a7",
      "address": "0x654d9138ce8d5bd9f288938992abb6dd9762c69f",
      "role": "verifier"
    }
  },
  "seriesPrivate": {
    "S1": {
      "termsPlain": {
        "theta": "82400000000",
        "rWad": "100000000000000",
        "currencyCode": 840,
        "indexingRule": 0,
        "termsSalt": "20923527994636606624794331144585152890556601148547187800101979110116723867504"
      },
      "termsCommitment": "0x0115825d76c26c3abd98ae5b7cb2368f7fe1aab2cd21383618c8db9c640da0b8"
    },
    "S2": {
      "termsPlain": {
        "theta": "80000000000",
        "rWad": "100000000000000",
        "currencyCode": 840,
        "indexingRule": 0,
        "termsSalt": "7938580866108859789592567293633425258476931234263603033736902031051234975251"
      },
      "termsCommitment": "0x0fec1eaf3b587aae3be6e3ab36b8737915ef6257e150dd5e82e5d21f95cc4af3"
    }
  },
  "steps": [
    {
      "t": "1767312000",
      "op": "register_attestor",
      "key": "attestor1"
    },
    {
      "t": "1767312000",
      "op": "register_attestor",
      "key": "attestor2"
    },
    {
      "t": "1767312000",
      "op": "register_verifier_key",
      "key": "verifier1"
    },
    {
      "t": "1767312000",
      "op": "allowlist",
      "wallets": [
        "issuer",
        "b1",
        "b2",
        "b3",
        "b4"
      ]
    },
    {
      "t": "1767312000",
      "op": "register_issuer",
      "wallet": "issuer"
    },
    {
      "t": "1767312000",
      "op": "fund",
      "actor": "issuer",
      "amount": "400000000000"
    },
    {
      "t": "1767312000",
      "op": "fund",
      "actor": "b1",
      "amount": "50000000000"
    },
    {
      "t": "1767312000",
      "op": "fund",
      "actor": "b2",
      "amount": "50000000000"
    },
    {
      "t": "1767312000",
      "op": "fund",
      "actor": "b3",
      "amount": "50000000000"
    },
    {
      "t": "1767312000",
      "op": "fund",
      "actor": "b4",
      "amount": "50000000000"
    },
    {
      "t": "1767312000",
      "op": "create_series",
      "actor": "issuer",
      "series": "S1",
      "terms": {
        "unitsOffered": "1000",
        "reservePrice": "100000000",
        "minRaise": "20000000000",
        "capMultipleWad": "2500000000000000000",
        "hurdleRateWad": "80000000000000000",
        "payoutMultipleK": "5",
        "lockupSeconds": "47336400",
        "walletCapBps": "1000",
        "auctionFeeBps": "100",
        "payoutFeeBps": "500",
        "windowFeeBps": "100",
        "nonRevealChargeBps": "100",
        "commitDuration": "604800",
        "revealDuration": "172800",
        "windowCommitDuration": "259200",
        "windowRevealDuration": "86400"
      },
      "releaseSchedule": [
        {
          "atOffsetSeconds": "0",
          "bps": "2500"
        },
        {
          "atOffsetSeconds": "7776000",
          "bps": "2500"
        },
        {
          "atOffsetSeconds": "15552000",
          "bps": "2500"
        },
        {
          "atOffsetSeconds": "23328000",
          "bps": "2500"
        }
      ],
      "termsCommitment": "0x2c8873ce98930df990524faea79407c1ff4ae23d783c8df6fcc1aeba18e00ba5",
      "contractHash": "0x4f5d300784a56e61ca3e6509452ff70f67316d1b486e4420da8cebef77e6a36e",
      "tierFlags": 2,
      "fxPairId": null
    },
    {
      "t": "1767312000",
      "op": "create_series",
      "actor": "issuer",
      "series": "S2",
      "terms": {
        "unitsOffered": "1000",
        "reservePrice": "100000000",
        "minRaise": "20000000000",
        "capMultipleWad": "2500000000000000000",
        "hurdleRateWad": "80000000000000000",
        "payoutMultipleK": "5",
        "lockupSeconds": "47336400",
        "walletCapBps": "1000",
        "auctionFeeBps": "100",
        "payoutFeeBps": "500",
        "windowFeeBps": "100",
        "nonRevealChargeBps": "100",
        "commitDuration": "604800",
        "revealDuration": "172800",
        "windowCommitDuration": "259200",
        "windowRevealDuration": "86400"
      },
      "releaseSchedule": [
        {
          "atOffsetSeconds": "0",
          "bps": "2500"
        },
        {
          "atOffsetSeconds": "7776000",
          "bps": "2500"
        },
        {
          "atOffsetSeconds": "15552000",
          "bps": "2500"
        },
        {
          "atOffsetSeconds": "23328000",
          "bps": "2500"
        }
      ],
      "termsCommitment": "0x02cd3cfc828daaf87f3927583b6b205e78bdabfd93e4f6d603841f82b9c9a5da",
      "contractHash": "0xdc102c66b057c7a832c2db8922c2be51dd15fa2ea507d493d365c0a65d66b4da",
      "tierFlags": 2,
      "fxPairId": null
    },
    {
      "t": "1767571200",
      "op": "open_raise",
      "actor": "issuer",
      "series": "S1"
    },
    {
      "t": "1767574800",
      "op": "commit_bid",
      "actor": "b1",
      "series": "S1",
      "price": "120000000",
      "quantity": "100",
      "salt": "0xcc37a16698d394a676b746f3b46b9c10e8a5f1800e9cdcac56ca7a44ccc94f38",
      "escrow": "12120000000"
    },
    {
      "t": "1767578400",
      "op": "commit_bid",
      "actor": "b2",
      "series": "S1",
      "price": "115000000",
      "quantity": "100",
      "salt": "0x1a49ec9d13989c3efe850d6a2c98fce30e70a21579d81abddfee4ae396ac9e0f",
      "escrow": "11615000000"
    },
    {
      "t": "1767582000",
      "op": "commit_bid",
      "actor": "b3",
      "series": "S1",
      "price": "110000000",
      "quantity": "100",
      "salt": "0xd47e9eec57aef7256f5a4f5702e00cb9741a51c82c773f1cd5d80ca4172bc913",
      "escrow": "11110000000"
    },
    {
      "t": "1767585600",
      "op": "commit_bid",
      "actor": "b4",
      "series": "S1",
      "price": "105000000",
      "quantity": "100",
      "salt": "0x900da0879044fc6c0f010f7aa11a18855937640b38bdf970e7e9e52cf83baa9a",
      "escrow": "10605000000"
    },
    {
      "t": "1768180200",
      "op": "reveal_bid",
      "actor": "b1",
      "series": "S1",
      "price": "120000000",
      "quantity": "100",
      "salt": "0xcc37a16698d394a676b746f3b46b9c10e8a5f1800e9cdcac56ca7a44ccc94f38"
    },
    {
      "t": "1768180800",
      "op": "reveal_bid",
      "actor": "b2",
      "series": "S1",
      "price": "115000000",
      "quantity": "100",
      "salt": "0x1a49ec9d13989c3efe850d6a2c98fce30e70a21579d81abddfee4ae396ac9e0f"
    },
    {
      "t": "1768181400",
      "op": "reveal_bid",
      "actor": "b3",
      "series": "S1",
      "price": "110000000",
      "quantity": "100",
      "salt": "0xd47e9eec57aef7256f5a4f5702e00cb9741a51c82c773f1cd5d80ca4172bc913"
    },
    {
      "t": "1768182000",
      "op": "reveal_bid",
      "actor": "b4",
      "series": "S1",
      "price": "105000000",
      "quantity": "100",